{
  "tool": "prettier",
  "version": "3.8.1",
  "timestamp": "2026-02-17T14:53:57.468Z",
  "exit_code": 0,
  "command": "llm-prettier.js src/",
  "summary": {
    "total_files": 1,
    "files_with_errors": 0,
    "error_count": 0,
    "warning_count": 0
  },
  "results": [
    {
      "file_path": "/workspace/test-fixtures/nodejs/prettier/pass/src/clean.js",
      "formatted": true
    }
  ]
}